{
  "cell_id": "level_b_qwen7b_bf16_math500_seed0",
  "model_config": "configs/legacy_models/deepseek_r1_qwen_7b.json",
  "task_config": "configs/tasks/math500.json",
  "quant_config": "bf16",
  "decoding_config": "configs/decoding/repro_qrm.yaml",
  "seed": 0,
  "prompt_profile": "sober",
  "notes": "Level B pilot — HPC for full runs; 5080 smoke only via smoke_qwen7b_bf16_5080."
}
