{
  "cell_id": "level_b_qwen7b_fp8_gsm8k_seed0",
  "model_config": "configs/legacy_models/deepseek_r1_qwen_7b_fp8.json",
  "task_config": "configs/tasks/gsm8k.json",
  "quant_config": "fp8",
  "decoding_config": "configs/decoding/repro_qrm.yaml",
  "seed": 0,
  "prompt_profile": "sober",
  "notes": "Level B pilot — second task template (GSM8K control)."
}
