{
  "cell_id": "level_a_qwen7b_bf16_math500_seed43",
  "model_config": "configs/legacy_models/deepseek_r1_qwen_7b.json",
  "task_config": "configs/tasks/math500.json",
  "quant_config": "bf16",
  "decoding_config": "configs/decoding/repro_qrm.yaml",
  "seed": 43,
  "prompt_profile": "reproduction",
  "notes": "QRM reproduction gate seed 43."
}
