{
  "cell_id": "level_b_qwen7b_gptq4_math500_seed0",
  "model_config": "configs/legacy_models/deepseek_r1_qwen_7b_gptq4.json",
  "task_config": "configs/tasks/math500.json",
  "quant_config": "gptq4",
  "decoding_config": "configs/decoding/repro_qrm.yaml",
  "seed": 0,
  "prompt_profile": "sober",
  "notes": "Level B pilot — same GPTQ-4 checkpoint as Level A reproduction."
}
