{
  "cell_id": "level_b_qwen7b_fp8_math500_seed0",
  "model_config": "configs/legacy_models/deepseek_r1_qwen_7b_fp8.json",
  "task_config": "configs/tasks/math500.json",
  "quant_config": "fp8",
  "decoding_config": "configs/decoding/repro_qrm.yaml",
  "seed": 0,
  "prompt_profile": "sober",
  "notes": "Level B pilot — primary RTX 5080 working quant for Qwen-7B."
}
